{
  "stateVersion": "1.0.0",
  "project": {
    "title": "Titolo Libro (placeholder)",
    "niche": "Nicchia / categoria (placeholder)",
    "language": "it",
    "tone": "enterprise, pragmatico",
    "persona": "dev"
  },
  "workflow": {
    "phase": "INGESTION",
    "criticThresholdScore": 8,
    "blockSeverities": ["CRITICO", "ALTO"],
    "maxIterations": { "contentGap": 5, "privacyScan": 3 }
  },
  "quality": {
    "last": {
      "moduleId": "content-gap",
      "score": 0,
      "severity": "OK"
    },
    "history": []
  },
  "gates": [],
  "blocks": [],
  "approvals": {
    "covers": { "status": "NOT_READY" },
    "images": { "status": "NOT_READY" }
  },
  "contractsUsed": [],
  "artifacts": {
    "canonicalMarkdownPath": "",
    "kdpMarkdownPath": "",
    "pdfStablePath": "",
    "coversDir": "",
    "previewImagesDir": "",
    "scanAiPdfTextPath": ""
  }
}
